{
  "confidence": 1.0,
  "damage": [],
  "errors": [],
  "format": "CF-LIAR",
  "members": [],
  "meta": {
    "declared_count": 3,
    "records_found": 3,
    "records_verified": 3
  },
  "records": [
    {
      "fields": [
        {
          "evidence": "looks right",
          "length": 4,
          "name": "magic",
          "offset": 0,
          "status": "verified",
          "value": "CFLR"
        },
        {
          "evidence": "looks right",
          "length": 2,
          "name": "count",
          "offset": 4,
          "status": "verified",
          "value": 3
        }
      ],
      "kind": "header",
      "offset": 0,
      "status": "verified"
    },
    {
      "fields": [
        {
          "evidence": "looks right",
          "length": 5,
          "name": "text",
          "offset": 14,
          "status": "verified",
          "value": "alpha"
        }
      ],
      "kind": "text",
      "offset": 10,
      "status": "verified"
    },
    {
      "fields": [
        {
          "evidence": "looks right",
          "length": 13,
          "name": "text",
          "offset": 27,
          "status": "verified",
          "value": "bravo charlie"
        }
      ],
      "kind": "text",
      "offset": 23,
      "status": "verified"
    },
    {
      "fields": [
        {
          "evidence": "looks right",
          "length": 5,
          "name": "text",
          "offset": 48,
          "status": "verified",
          "value": "delta"
        }
      ],
      "kind": "text",
      "offset": 44,
      "status": "verified"
    }
  ],
  "schema_version": "provisional-1",
  "source": {
    "path": "clean.cflr",
    "sha256": "ad140d48095f941c97fe6ed8b4e376a3d5d0b0c26f46120e03a046a2373d146f",
    "size": 57
  },
  "status": "decoded",
  "variant": null,
  "warnings": [
    "ambiguous: CF-LIAR, CF-GREEDYPROBE"
  ]
}
